<?xml version="1.0" encoding="UTF-8"?>
<xs:schema 
	xmlns:xs="http://www.w3.org/2001/XMLSchema"
	xmlns="http://www.w3school.com"
	targetNamespace="http://www.w3school.com"  
	elementFormDefault="qualified">

	<xs:element name="interfaces">
		<xs:complexType>
			<xs:sequence>
				<xs:element name="alias-mappings" minOccurs="1" maxOccurs="1">
					<xs:complexType>
						<xs:sequence>
							<xs:element name="mapping" type="aliasMappingType" minOccurs="0" maxOccurs="unbounded"/>
						</xs:sequence>
					</xs:complexType>
				</xs:element>
				<xs:element name="metadatas-pool" minOccurs="1" maxOccurs="1">
					<xs:complexType>
						<xs:sequence minOccurs="0" maxOccurs="unbounded">
							<xs:element name="variable-field" type="variableFieldType" minOccurs="0" maxOccurs="unbounded"/>
							<xs:element name="fixed-field"    type="fixedFieldType"    minOccurs="0" maxOccurs="unbounded"/>
						</xs:sequence>
					</xs:complexType>
				</xs:element>
				<xs:element name="interface" minOccurs="1" maxOccurs="1">
					<xs:complexType>
						<xs:sequence>
							<!-- 请求节点 -->
							<xs:element name="request" minOccurs="1" maxOccurs="1">
								<xs:complexType>
									<xs:sequence minOccurs="0" maxOccurs="unbounded">
										<xs:element name="fixed-field"    type="fixedFieldType"    minOccurs="0" maxOccurs="unbounded"/>
										<xs:element name="field"          type="referFieldType"    minOccurs="0" maxOccurs="unbounded"/>
										<xs:element name="object"         type="objectType"        minOccurs="0" maxOccurs="unbounded"/>
									</xs:sequence>
								</xs:complexType>
							</xs:element>
							<!-- 应答节点 -->
							<xs:element name="response" minOccurs="1" maxOccurs="1">
								<xs:complexType>
									<xs:sequence minOccurs="0" maxOccurs="unbounded">
										<xs:element name="fixed-field"    type="fixedFieldType"    minOccurs="0" maxOccurs="unbounded"/>
										<xs:element name="field"          type="referFieldType"    minOccurs="0" maxOccurs="unbounded"/>
										<xs:element name="object"         type="objectType"        minOccurs="0" maxOccurs="unbounded"/>
									</xs:sequence>
								</xs:complexType>
							</xs:element>
						</xs:sequence>
						<xs:attribute name="name" type="nameType" use="required"/>
					</xs:complexType>
				</xs:element>
			</xs:sequence>
		</xs:complexType>
	</xs:element>

	<xs:simpleType name="nameType">
		<xs:restriction base="xs:string">
			<xs:pattern value="[a-zA-Z0-9_]{0,20}"/>
		</xs:restriction>
	</xs:simpleType>
	<!-- 基础元信息名称类型定义 -->
	<xs:simpleType name="fieldNameType">
		<xs:restriction base="xs:string">
			<xs:pattern value="[a-zA-Z0-9_\.]{0,50}"/>
		</xs:restriction>
	</xs:simpleType>
	<!-- 基础元信息别名类型定义 -->
	<xs:simpleType name="fieldAliasType">
		<xs:restriction base="xs:string">
			<xs:pattern value="[a-zA-Z0-9_]{0,20}"/>
		</xs:restriction>
	</xs:simpleType>
	<!-- 基础元信息字段描述定义 -->
	<xs:simpleType name="fieldDescType">
		<xs:restriction base="xs:string">
			<xs:pattern value="\w{0,20}"/>
		</xs:restriction>
	</xs:simpleType>
	<!-- 基础元信息字段描述定义 -->
	<xs:simpleType name="fieldLenType">
		<xs:restriction base="xs:integer"/>
	</xs:simpleType>
	<!-- 基础元信息字段Java类型定义 -->
	<xs:simpleType name="fieldClassType">
		<xs:restriction base="xs:string">
			<xs:enumeration value="String"/>
			<xs:enumeration value="Integer"/>
			<xs:enumeration value="BigDecimal"/>
			<xs:enumeration value="Date"/>
			<xs:enumeration value="ByteBuffer"/>
			<xs:enumeration value="Money"/>
		</xs:restriction>
	</xs:simpleType>
	<!-- 基础元信息字段允许为null类型定义 -->
	<xs:simpleType name="fieldAllowNullType">
		<xs:restriction base="xs:boolean"/>
	</xs:simpleType>
	<!-- 基础元信息字段允许为填充样式类型定义 -->
	<xs:simpleType name="fieldFillStyleType">
		<xs:restriction base="xs:string">
			<xs:enumeration value="right"/>
			<xs:enumeration value="left"/>
		</xs:restriction>
	</xs:simpleType>
	<!-- 编码属性定义 -->
	<xs:simpleType name="encodingType">
		<xs:restriction base="xs:string">
			<xs:enumeration value="GBK"/>
			<xs:enumeration value="GB2312"/>
			<xs:enumeration value="ISO8859-1"/>
			<xs:enumeration value="UTF-8"/>
			<xs:enumeration value="Big5"/>
			<xs:enumeration value="EBCDIC"/>
		</xs:restriction>
	</xs:simpleType>
	<!-- 别名类型 -->
	<xs:complexType name="aliasMappingType">
		<xs:attribute name="alias" type="xs:string"/>
		<xs:attribute name="real" type="xs:string"/>
		<xs:attribute name="domain">
			<xs:simpleType>
				<xs:restriction base="xs:string">
					<xs:enumeration value="global"/>
					<xs:enumeration value="inner"/>
				</xs:restriction>
			</xs:simpleType>
		</xs:attribute>
	</xs:complexType>
	<!-- 数据类型 -->
	<xs:simpleType name="valueModeType">
		<xs:restriction base="xs:string">
			<xs:enumeration value="constant"/>
			<xs:enumeration value="default"/>
			<xs:enumeration value="user"/>
			<xs:enumeration value="inner"/>
		</xs:restriction>
	</xs:simpleType>
	
	<!-- 交易数据对象名称属性定义 -->
	<xs:simpleType name="objectNameType">
		<xs:restriction base="xs:string"/>
	</xs:simpleType>
	<!-- 交易数据对象类型属性定义 -->
	<xs:simpleType name="objectTypeType">
		<xs:restriction base="xs:string">
			<xs:enumeration value="bean"/>
			<xs:enumeration value="form"/>
		</xs:restriction>
	</xs:simpleType>
	<!-- 交易数据对象描述属性定义 -->
	<xs:simpleType name="objectDescType">
		<xs:restriction base="xs:string">
			<xs:minLength value="0"/>
			<xs:maxLength value="200"/>
		</xs:restriction>
	</xs:simpleType>
	<!-- 交易数据对象编码属性定义 -->
	<xs:simpleType name="objectEncodingType">
		<xs:restriction base="encodingType"/>
	</xs:simpleType>
	<!-- 交易数据对象包装类属性定义 -->
	<xs:simpleType name="objectWrapClassType">
		<xs:restriction base="xs:string"/>
	</xs:simpleType>

	<!-- 定长字段节点定义 -->
	<xs:complexType name="fixedFieldType">
		<xs:attribute name="name"       type="fieldNameType"      use="required"/>
		<xs:attribute name="alias"      type="fieldAliasType"     use="optional"/>
		<xs:attribute name="desc"       type="fieldDescType"                     default="字段描述"/>
		<xs:attribute name="encoding"   type="encodingType"       use="optional" default="UTF-8"/>
		<xs:attribute name="fill-style" type="fieldFillStyleType" use="optional"/>
		<xs:attribute name="len"        type="fieldLenType"       use="required"/>
		<xs:attribute name="class"      type="fieldClassType"     use="required"/>
		<xs:attribute name="value-mode" type="valueModeType"/>
		<xs:attribute name="value"      type="xs:string"/>
		<xs:attribute name="fill-char"  type="xs:string"          use="optional"/>
		<xs:attribute name="format"     type="xs:string"          use="optional"/>
		<xs:attribute name="scale"      type="xs:integer"         use="optional"/>
	</xs:complexType>
	<!-- 不定长字段节点定义 -->
	<xs:complexType name="variableFieldType">
		<xs:attribute name="name"       type="fieldNameType"      use="required"/>
		<xs:attribute name="alias"      type="fieldAliasType"     use="optional"/>
		<xs:attribute name="desc"       type="fieldDescType"                     default="字段描述"/>
		<xs:attribute name="encoding"   type="encodingType"       use="optional" default="UTF-8"/>
		<xs:attribute name="max-len"    type="fieldLenType"       use="required"/>
		<xs:attribute name="min-len"    type="fieldLenType"       use="required"/>
		<xs:attribute name="allow-null" type="fieldAllowNullType" use="required"/>
		<xs:attribute name="class"      type="fieldClassType"     use="required"/>
		<xs:attribute name="value-mode" type="valueModeType"/>
		<xs:attribute name="value"      type="xs:string"/>
		<xs:attribute name="format"     type="xs:string"          use="optional"/>
		<xs:attribute name="scale"      type="xs:integer"         use="optional"/>
	</xs:complexType>
	<!-- 交易数据对象字段引用定义 -->
	<xs:complexType name="referFieldType">
		<xs:sequence minOccurs="0" maxOccurs="99">
			<xs:element name="mapping" minOccurs="0" maxOccurs="unbounded">
				<xs:complexType>
					<xs:attribute name="express-id"  type="xs:integer"     use="required"/>
					<xs:attribute name="trade-code"  type="xs:string"      use="required"/>
					<xs:attribute name="value"       type="xs:string"      use="required"/>
					<xs:attribute name="value-mode"  type="valueModeType"/>
				</xs:complexType>
			</xs:element>
		</xs:sequence>
		<xs:attribute name="name"       type="fieldNameType"      use="required"/>
		<xs:attribute name="alias"      type="fieldAliasType"     use="required"/>
		<xs:attribute name="desc"       type="fieldDescType"                     default="引用字段描述"/>
		<xs:attribute name="value"      type="xs:string"          use="optional"/>
		<xs:attribute name="value-mode" type="valueModeType"/>
	</xs:complexType>
	<!-- 交易数据对象定义 -->
	<xs:complexType name="objectType">
		<xs:sequence minOccurs="0" maxOccurs="99">
			<xs:element name="field"          type="referFieldType"       minOccurs="0" maxOccurs="unbounded"/>
			<xs:element name="variable-field" type="variableFieldType"    minOccurs="0" maxOccurs="unbounded"/>
			<xs:element name="fixed-field"    type="fixedFieldType"       minOccurs="0" maxOccurs="unbounded"/>
		</xs:sequence>
		<xs:attribute name="name"       type="objectNameType"      use="required"/>
		<xs:attribute name="alias"      type="fieldAliasType"      use="optional"/>
		<xs:attribute name="desc"       type="objectDescType"                     default="对象描述"/>
		<xs:attribute name="encoding"   type="encodingType"        use="optional" default="UTF-8"/>
		<xs:attribute name="value"      type="xs:string"           use="optional"/>
		<xs:attribute name="type"       type="objectTypeType"      use="required"/>
		<xs:attribute name="wrap-class" type="objectWrapClassType" use="required"/>
	</xs:complexType>
</xs:schema>
